{
  "$schema": "https://json-schema.org/draft/2020-12/schema",
  "$id": "https://local.schemas.maple-automation.local/runtime-manifest.schema.json",
  "title": "Maple Automation Core Runtime Manifest",
  "type": "object",
  "$defs": {
    "sha256": {
      "type": "string",
      "pattern": "^[A-Fa-f0-9]{64}$"
    },
    "gitCommit": {
      "type": "string",
      "pattern": "^[A-Fa-f0-9]{40}$"
    },
    "nonEmptyId": {
      "type": "string",
      "minLength": 1
    },
    "version": {
      "type": "string",
      "pattern": "^\\d+\\.\\d+\\.\\d+$"
    }
  },
  "required": [
    "local_urn",
    "runtime_manifest_version",
    "release_id",
    "source_commit",
    "upstream_commit",
    "config_schema",
    "effective_config_sha256",
    "profile_id",
    "profile_sha256",
    "model_id",
    "model_sha256",
    "classes",
    "classes_sha256",
    "input_size",
    "key_bindings",
    "thresholds",
    "dataset_version",
    "split_sha256",
    "map_id",
    "map_fingerprint",
    "platform_graph_sha256",
    "route_manifest_sha256",
    "movement_profile_sha256",
    "receiver_version",
    "receiver_hash",
    "test_report_id",
    "replay_report_id",
    "shadow_report_id",
    "clean_report_id"
  ],
  "properties": {
    "local_urn": {
      "type": "string",
      "pattern": "^urn:maple:local:[A-Za-z0-9][A-Za-z0-9._-]{2,80}:[A-Fa-f0-9]{40}$",
      "description": "Local URN binding this manifest to an auditable on-host artifact."
    },
    "bundle_status": {
      "type": "string",
      "enum": [
        "candidate",
        "offline-valid",
        "replay-valid",
        "shadow",
        "canary",
        "certified",
        "quarantined"
      ],
      "description": "Lifecycle state; a candidate or shadow manifest is not field certification."
    },
    "execution_mode": {
      "type": "string",
      "enum": [
        "offline",
        "shadow",
        "dry-run",
        "canary",
        "live"
      ],
      "description": "Execution mode bound to this manifest."
    },
    "subject_id": {
      "type": "string",
      "pattern": "^subject-[a-z0-9][a-z0-9._-]{1,64}$",
      "description": "Pseudonymous subject identifier; account and character names are excluded."
    },
    "input_owner": {
      "type": "string",
      "enum": [
        "legacy",
        "core-v2",
        "none"
      ],
      "description": "Current real-input owner."
    },
    "real_input_enabled": {
      "type": "boolean",
      "description": "Explicit real-input gate. Candidate/Shadow manifests set this to false."
    },
    "asset_index_path": {
      "type": "string",
      "minLength": 1,
      "pattern": "^(?!/)(?![A-Za-z]:)(?!\\\\)(?!.*\\\\)(?!.*(?:^|/)\\.\\.?(?:/|$)).+$",
      "description": "Repository-relative asset index path."
    },
    "asset_index_sha256": {
      "$ref": "#/$defs/sha256",
      "description": "SHA-256 of the asset index bytes."
    },
    "evidence_index_path": {
      "type": "string",
      "minLength": 1,
      "pattern": "^(?!/)(?![A-Za-z]:)(?!\\\\)(?!.*\\\\)(?!.*(?:^|/)\\.\\.?(?:/|$)).+$",
      "description": "Repository-relative evidence index path."
    },
    "evidence_index_sha256": {
      "$ref": "#/$defs/sha256",
      "description": "SHA-256 of the evidence index bytes."
    },
    "runtime_manifest_version": {
      "$ref": "#/$defs/version",
      "description": "Manifest schema version for runtime validation."
    },
    "release_id": {
      "allOf": [
        {
          "$ref": "#/$defs/nonEmptyId"
        },
        {
          "pattern": "^[A-Za-z0-9][A-Za-z0-9._-]{2,128}$"
        }
      ],
      "description": "Release identifier, e.g. date+ticket or hash suffix."
    },
    "source_commit": {
      "$ref": "#/$defs/gitCommit",
      "description": "Git commit hash of Core v2 source used for this release."
    },
    "upstream_commit": {
      "$ref": "#/$defs/gitCommit",
      "description": "Reference commit hash from upstream/legacy integration source."
    },
    "config_schema": {
      "$ref": "#/$defs/version",
      "description": "Configuration schema version used by runtime profile."
    },
    "effective_config_sha256": {
      "$ref": "#/$defs/sha256",
      "description": "SHA-256 of the resolved runtime config file."
    },
    "profile_id": {
      "allOf": [
        {
          "$ref": "#/$defs/nonEmptyId"
        },
        {
          "pattern": "^[A-Za-z0-9][A-Za-z0-9._-]{2,64}$"
        }
      ],
      "description": "Character/account profile identifier."
    },
    "profile_sha256": {
      "$ref": "#/$defs/sha256",
      "description": "SHA-256 of profile bundle."
    },
    "model_id": {
      "allOf": [
        {
          "$ref": "#/$defs/nonEmptyId"
        },
        {
          "pattern": "^[A-Za-z0-9][A-Za-z0-9._-]{2,64}$"
        }
      ],
      "description": "Model identifier used for vision/prediction."
    },
    "model_sha256": {
      "$ref": "#/$defs/sha256",
      "description": "SHA-256 of model binary/artifact."
    },
    "classes": {
      "type": "array",
      "minItems": 1,
      "uniqueItems": true,
      "items": {
        "allOf": [
          {
            "$ref": "#/$defs/nonEmptyId"
          },
          {
            "pattern": "^[a-z_][a-z0-9_]{1,48}$"
          }
        ]
      },
      "description": "Model class labels in runtime use."
    },
    "classes_sha256": {
      "$ref": "#/$defs/sha256",
      "description": "SHA-256 of the ordered runtime class-label definition."
    },
    "input_size": {
      "type": "object",
      "required": ["width", "height"],
      "properties": {
        "width": { "type": "integer", "minimum": 1, "maximum": 8192 },
        "height": { "type": "integer", "minimum": 1, "maximum": 8192 }
      },
      "additionalProperties": false,
      "description": "Model input dimensions."
    },
    "key_bindings": {
      "type": "object",
      "required": ["left", "right", "up", "down", "attack", "jump", "hp", "mp"],
      "properties": {
        "left": { "type": "string", "const": "left" },
        "right": { "type": "string", "const": "right" },
        "up": { "type": "string", "const": "up" },
        "down": { "type": "string", "const": "down" },
        "attack": { "type": "string", "const": "a" },
        "jump": { "type": "string", "const": "alt" },
        "hp": { "type": "string", "const": "insert" },
        "mp": { "type": "string", "const": "delete" },
        "pickup": { "type": "string", "const": "z" },
        "confirm": { "type": "string", "const": "space" },
        "party": { "type": "string", "const": "p" }
      },
      "additionalProperties": false,
      "description": "Frozen DEC-001 semantic key bindings for the Pilot candidate."
    },
    "thresholds": {
      "type": "object",
      "required": [
        "detection_confidence",
        "tracking_confidence",
        "recover_stale_ms"
      ],
      "properties": {
        "detection_confidence": {
          "type": "number",
          "minimum": 0,
          "maximum": 1
        },
        "tracking_confidence": {
          "type": "number",
          "minimum": 0,
          "maximum": 1
        },
        "recover_stale_ms": {
          "type": "integer",
          "minimum": 1
        },
        "observation_stale_ms": {
          "type": "integer",
          "minimum": 1
        },
        "action_timeout_ms": {
          "type": "integer",
          "minimum": 1
        }
      },
      "additionalProperties": false,
      "description": "Runtime thresholds and fallback timings."
    },
    "dataset_version": {
      "$ref": "#/$defs/nonEmptyId",
      "description": "Dataset version used for training/evaluation."
    },
    "split_sha256": {
      "$ref": "#/$defs/sha256",
      "description": "SHA-256 of data split definition used for model."
    },
    "map_id": {
      "allOf": [
        {
          "$ref": "#/$defs/nonEmptyId"
        },
        {
          "pattern": "^[A-Za-z0-9][A-Za-z0-9._-]{2,128}$"
        }
      ],
      "description": "Logical map identifier."
    },
    "map_fingerprint": {
      "$ref": "#/$defs/sha256",
      "description": "SHA-256 of map registry and registration outputs."
    },
    "platform_graph_sha256": {
      "$ref": "#/$defs/sha256",
      "description": "SHA-256 of PlatformGraph payload."
    },
    "route_manifest_sha256": {
      "$ref": "#/$defs/sha256",
      "description": "SHA-256 of route/mission manifest."
    },
    "movement_profile_sha256": {
      "$ref": "#/$defs/sha256",
      "description": "SHA-256 of movement profile data."
    },
    "receiver_version": {
      "$ref": "#/$defs/nonEmptyId",
      "description": "Input receiver/runtime adapter version used by execution layer."
    },
    "receiver_hash": {
      "$ref": "#/$defs/sha256",
      "description": "SHA-256 of the input receiver binary/config bundle."
    },
    "test_report_id": {
      "$ref": "#/$defs/nonEmptyId",
      "description": "ID of the complete test report associated with this release."
    },
    "replay_report_id": {
      "$ref": "#/$defs/nonEmptyId",
      "description": "ID of deterministic replay evidence report."
    },
    "shadow_report_id": {
      "$ref": "#/$defs/nonEmptyId",
      "description": "ID of the dry-run Shadow evidence report."
    },
    "clean_report_id": {
      "$ref": "#/$defs/nonEmptyId",
      "description": "ID of the cacheless Windows clean-smoke evidence report."
    },
    "field_session_ids": {
      "type": "array",
      "uniqueItems": true,
      "items": {
        "$ref": "#/$defs/nonEmptyId"
      },
      "description": "Session IDs collected during validation (可选)."
    },
    "rollback_release_id": {
      "allOf": [
        {
          "$ref": "#/$defs/nonEmptyId"
        },
        {
          "pattern": "^[A-Za-z0-9][A-Za-z0-9._-]{2,128}$"
        }
      ],
      "description": "Previous release id used for rollback binding (可选)."
    },
    "created_at": {
      "type": "string",
      "format": "date-time",
      "pattern": "^\\d{4}-\\d{2}-\\d{2}T\\d{2}:\\d{2}:\\d{2}(?:\\.\\d+)?(?:Z|[+-]\\d{2}:\\d{2})$",
      "description": "ISO8601 UTC timestamp."
    }
  },
  "additionalProperties": false
}
